{
  "schema_version": "0.1.0",
  "run_id": "run-schema-smoke-001",
  "kind": "eval",
  "suite_id": "harness-self-test",
  "task_id": "schema-smoke",
  "task_version": "1.0.0",
  "dataset_hash": "sha256:27aa95663ba3847b713dae33b3beed3a33280d3aeeff5cb9177f5bc9817c81fd",
  "split": "optimization",
  "model_profile": "harness://verifier-only/no-model",
  "harness_version": "0.1.0",
  "status": "passed",
  "execution": {
    "mode": "verifier-only",
    "harness_status": "passed",
    "verifier_status": "passed"
  },
  "usage": {
    "billed_model_id": "verifier-only",
    "input_tokens": 0,
    "output_tokens": 0,
    "total_tokens": 0,
    "requests": 0,
    "incurred_cost_usd": 0,
    "source": "stub"
  },
  "trace": "harness://verifier-only/no-agent-trace",
  "verifier_result": "examples/verifier-results/schema-smoke.json",
  "artifacts": [
    {
      "path": "examples/harness.yaml",
      "media_type": "application/yaml",
      "description": "Validated harness example."
    }
  ]
}
